{
  "schemaVersion": "broadcaster-schedule-export.v1",
  "snapshotId": "stan-sport-au-reviewed-20261011",
  "sourceId": "stan_sport",
  "sourceMode": "reviewed_export",
  "territory": "AU",
  "sourceUrl": "https://www.stan.com.au/watch/sport",
  "observedAt": "2026-10-10T23:30:09Z",
  "reviewedAt": "2026-10-10T23:30:09Z",
  "reviewedBy": "Nothing Sport manual source review — selected public guide dates only; timezone and individual fixtures unconfirmed",
  "windowStart": "2026-10-11",
  "windowEnd": "2026-10-18",
  "checksum": "sha256:4ee32dd0369e6ae0939f8142466b623035e1e689046d53acfb490cc74268badf",
  "items": [
    {
      "sourceListingId": "stan-reviewed-20261011-001",
      "rawTitle": "WTA 1000",
      "rawSport": "Tennis",
      "rawCompetition": "WTA 1000",
      "rawParticipants": [],
      "channelBrand": "Stan Sport",
      "territory": "AU",
      "serviceId": "stan_sport",
      "accessType": "included",
      "liveOrReplay": "live",
      "timeConfidence": "date_only",
      "localDate": "2026-10-11",
      "programmeStartsAtUtc": null,
      "eventStartsAtUtc": null,
      "scheduleTimeZone": null,
      "sourceUrl": "https://www.stan.com.au/watch/sport"
    },
    {
      "sourceListingId": "stan-reviewed-20261011-002",
      "rawTitle": "UEFA Champions League",
      "rawSport": "Football",
      "rawCompetition": "UEFA Champions League",
      "rawParticipants": [],
      "channelBrand": "Stan Sport",
      "territory": "AU",
      "serviceId": "stan_sport",
      "accessType": "included",
      "liveOrReplay": "live",
      "timeConfidence": "date_only",
      "localDate": "2026-10-14",
      "programmeStartsAtUtc": null,
      "eventStartsAtUtc": null,
      "scheduleTimeZone": null,
      "sourceUrl": "https://www.stan.com.au/watch/sport"
    },
    {
      "sourceListingId": "stan-reviewed-20261011-003",
      "rawTitle": "UEFA Conference League",
      "rawSport": "Football",
      "rawCompetition": "UEFA Conference League",
      "rawParticipants": [],
      "channelBrand": "Stan Sport",
      "territory": "AU",
      "serviceId": "stan_sport",
      "accessType": "included",
      "liveOrReplay": "live",
      "timeConfidence": "date_only",
      "localDate": "2026-10-16",
      "programmeStartsAtUtc": null,
      "eventStartsAtUtc": null,
      "scheduleTimeZone": null,
      "sourceUrl": "https://www.stan.com.au/watch/sport"
    },
    {
      "sourceListingId": "stan-reviewed-20261011-004",
      "rawTitle": "UEFA Europa League",
      "rawSport": "Football",
      "rawCompetition": "UEFA Europa League",
      "rawParticipants": [],
      "channelBrand": "Stan Sport",
      "territory": "AU",
      "serviceId": "stan_sport",
      "accessType": "included",
      "liveOrReplay": "live",
      "timeConfidence": "date_only",
      "localDate": "2026-10-16",
      "programmeStartsAtUtc": null,
      "eventStartsAtUtc": null,
      "scheduleTimeZone": null,
      "sourceUrl": "https://www.stan.com.au/watch/sport"
    },
    {
      "sourceListingId": "stan-reviewed-20261011-005",
      "rawTitle": "Bledisloe Cup",
      "rawSport": "Rugby",
      "rawCompetition": "Bledisloe Cup",
      "rawParticipants": [],
      "channelBrand": "Stan Sport",
      "territory": "AU",
      "serviceId": "stan_sport",
      "accessType": "included",
      "liveOrReplay": "live",
      "timeConfidence": "date_only",
      "localDate": "2026-10-17",
      "programmeStartsAtUtc": null,
      "eventStartsAtUtc": null,
      "scheduleTimeZone": null,
      "sourceUrl": "https://www.stan.com.au/watch/sport"
    },
    {
      "sourceListingId": "stan-reviewed-20261011-006",
      "rawTitle": "WEC",
      "rawSport": "Motorsport",
      "rawCompetition": "WEC",
      "rawParticipants": [],
      "channelBrand": "Stan Sport",
      "territory": "AU",
      "serviceId": "stan_sport",
      "accessType": "included",
      "liveOrReplay": "live",
      "timeConfidence": "date_only",
      "localDate": "2026-10-17",
      "programmeStartsAtUtc": null,
      "eventStartsAtUtc": null,
      "scheduleTimeZone": null,
      "sourceUrl": "https://www.stan.com.au/watch/sport"
    },
    {
      "sourceListingId": "stan-reviewed-20261011-007",
      "rawTitle": "WSL",
      "rawSport": "Football",
      "rawCompetition": "WSL",
      "rawParticipants": [],
      "channelBrand": "Stan Sport",
      "territory": "AU",
      "serviceId": "stan_sport",
      "accessType": "included",
      "liveOrReplay": "live",
      "timeConfidence": "date_only",
      "localDate": "2026-10-17",
      "programmeStartsAtUtc": null,
      "eventStartsAtUtc": null,
      "scheduleTimeZone": null,
      "sourceUrl": "https://www.stan.com.au/watch/sport"
    },
    {
      "sourceListingId": "stan-reviewed-20261011-008",
      "rawTitle": "NWSL",
      "rawSport": "Football",
      "rawCompetition": "NWSL",
      "rawParticipants": [],
      "channelBrand": "Stan Sport",
      "territory": "AU",
      "serviceId": "stan_sport",
      "accessType": "included",
      "liveOrReplay": "live",
      "timeConfidence": "date_only",
      "localDate": "2026-10-18",
      "programmeStartsAtUtc": null,
      "eventStartsAtUtc": null,
      "scheduleTimeZone": null,
      "sourceUrl": "https://www.stan.com.au/watch/sport"
    },
    {
      "sourceListingId": "stan-reviewed-20261011-009",
      "rawTitle": "PL Saturday Wrap",
      "rawSport": "Football",
      "rawCompetition": "PL Saturday Wrap",
      "rawParticipants": [],
      "channelBrand": "Stan Sport",
      "territory": "AU",
      "serviceId": "stan_sport",
      "accessType": "included",
      "liveOrReplay": "studio",
      "timeConfidence": "date_only",
      "localDate": "2026-10-18",
      "programmeStartsAtUtc": null,
      "eventStartsAtUtc": null,
      "scheduleTimeZone": null,
      "sourceUrl": "https://www.stan.com.au/watch/sport"
    }
  ]
}
