{
  "schemaVersion": "broadcaster-schedule-export.v1",
  "snapshotId": "stan-sport-au-reviewed-20261001",
  "sourceId": "stan_sport",
  "sourceMode": "reviewed_export",
  "territory": "AU",
  "sourceUrl": "https://www.stan.com.au/watch/sport",
  "observedAt": "2026-09-30T22:37:31.000Z",
  "reviewedAt": "2026-09-30T22:37:31.000Z",
  "reviewedBy": "Nothing Sport source review — official public schedule, 1–7 October factual listings",
  "windowStart": "2026-10-01",
  "windowEnd": "2026-10-07",
  "checksum": "sha256:cf07575f55e455e8adcfcc54cbed2c0c6b88bf1c7b7bbe740ea656d4f8d03efb",
  "items": [
    {
      "sourceListingId": "stan-reviewed-20261001-001",
      "rawTitle": "NPC",
      "rawSport": "Rugby",
      "rawCompetition": "NPC",
      "rawParticipants": [],
      "channelBrand": "Stan Sport",
      "territory": "AU",
      "serviceId": "stan_sport",
      "accessType": "included",
      "liveOrReplay": "live",
      "timeConfidence": "exact",
      "localDate": "2026-10-01",
      "programmeStartsAtUtc": "2026-10-01T06:00:00Z",
      "eventStartsAtUtc": "2026-10-01T06:05:00Z",
      "scheduleTimeText": "2026-10-01 programme 16:00; event 16:05",
      "scheduleTimeZone": "Australia/Sydney",
      "sourceUrl": "https://www.stan.com.au/watch/sport"
    },
    {
      "sourceListingId": "stan-reviewed-20261001-002",
      "rawTitle": "WRC",
      "rawSport": "Motorsport",
      "rawCompetition": "WRC",
      "rawParticipants": [],
      "channelBrand": "Stan Sport",
      "territory": "AU",
      "serviceId": "stan_sport",
      "accessType": "included",
      "liveOrReplay": "live",
      "timeConfidence": "exact",
      "localDate": "2026-10-02",
      "programmeStartsAtUtc": "2026-10-01T14:00:00Z",
      "eventStartsAtUtc": "2026-10-01T14:00:00Z",
      "scheduleTimeText": "2026-10-02 programme 00:00; event 00:00",
      "scheduleTimeZone": "Australia/Sydney",
      "sourceUrl": "https://www.stan.com.au/watch/sport"
    },
    {
      "sourceListingId": "stan-reviewed-20261001-003",
      "rawTitle": "WTA 1000",
      "rawSport": "Tennis",
      "rawCompetition": "WTA 1000",
      "rawParticipants": [],
      "channelBrand": "Stan Sport",
      "territory": "AU",
      "serviceId": "stan_sport",
      "accessType": "included",
      "liveOrReplay": "live",
      "timeConfidence": "exact",
      "localDate": "2026-10-02",
      "programmeStartsAtUtc": "2026-10-02T03:00:00Z",
      "eventStartsAtUtc": "2026-10-02T03:00:00Z",
      "scheduleTimeText": "2026-10-02 programme 13:00; event 13:00",
      "scheduleTimeZone": "Australia/Sydney",
      "sourceUrl": "https://www.stan.com.au/watch/sport"
    },
    {
      "sourceListingId": "stan-reviewed-20261001-004",
      "rawTitle": "UCI Mountain Bike World Series",
      "rawSport": "Cycling",
      "rawCompetition": "UCI Mountain Bike World Series",
      "rawParticipants": [],
      "channelBrand": "Stan Sport",
      "territory": "AU",
      "serviceId": "stan_sport",
      "accessType": "included",
      "liveOrReplay": "live",
      "timeConfidence": "exact",
      "localDate": "2026-10-03",
      "programmeStartsAtUtc": "2026-10-02T15:30:00Z",
      "eventStartsAtUtc": "2026-10-02T15:45:00Z",
      "scheduleTimeText": "2026-10-03 programme 01:30; event 01:45",
      "scheduleTimeZone": "Australia/Sydney",
      "sourceUrl": "https://www.stan.com.au/watch/sport"
    },
    {
      "sourceListingId": "stan-reviewed-20261001-005",
      "rawTitle": "Premiership Rugby",
      "rawSport": "Rugby",
      "rawCompetition": "Premiership Rugby",
      "rawParticipants": [],
      "channelBrand": "Stan Sport",
      "territory": "AU",
      "serviceId": "stan_sport",
      "accessType": "included",
      "liveOrReplay": "live",
      "timeConfidence": "exact",
      "localDate": "2026-10-03",
      "programmeStartsAtUtc": "2026-10-02T18:40:00Z",
      "eventStartsAtUtc": "2026-10-02T18:45:00Z",
      "scheduleTimeText": "2026-10-03 programme 04:40; event 04:45",
      "scheduleTimeZone": "Australia/Sydney",
      "sourceUrl": "https://www.stan.com.au/watch/sport"
    },
    {
      "sourceListingId": "stan-reviewed-20261001-006",
      "rawTitle": "NWSL",
      "rawSport": "Football",
      "rawCompetition": "NWSL",
      "rawParticipants": [],
      "channelBrand": "Stan Sport",
      "territory": "AU",
      "serviceId": "stan_sport",
      "accessType": "included",
      "liveOrReplay": "live",
      "timeConfidence": "exact",
      "localDate": "2026-10-03",
      "programmeStartsAtUtc": "2026-10-03T02:00:00Z",
      "eventStartsAtUtc": "2026-10-03T02:05:00Z",
      "scheduleTimeText": "2026-10-03 programme 12:00; event 12:05",
      "scheduleTimeZone": "Australia/Sydney",
      "sourceUrl": "https://www.stan.com.au/watch/sport"
    },
    {
      "sourceListingId": "stan-reviewed-20261001-007",
      "rawTitle": "Super Rugby AUS",
      "rawSport": "Rugby",
      "rawCompetition": "Super Rugby AUS",
      "rawParticipants": [],
      "channelBrand": "Stan Sport",
      "territory": "AU",
      "serviceId": "stan_sport",
      "accessType": "included",
      "liveOrReplay": "live",
      "timeConfidence": "exact",
      "localDate": "2026-10-03",
      "programmeStartsAtUtc": "2026-10-03T06:30:00Z",
      "eventStartsAtUtc": "2026-10-03T06:35:00Z",
      "scheduleTimeText": "2026-10-03 programme 16:30; event 16:35",
      "scheduleTimeZone": "Australia/Sydney",
      "sourceUrl": "https://www.stan.com.au/watch/sport"
    },
    {
      "sourceListingId": "stan-reviewed-20261001-008",
      "rawTitle": "WSL",
      "rawSport": "Football",
      "rawCompetition": "WSL",
      "rawParticipants": [],
      "channelBrand": "Stan Sport",
      "territory": "AU",
      "serviceId": "stan_sport",
      "accessType": "included",
      "liveOrReplay": "live",
      "timeConfidence": "exact",
      "localDate": "2026-10-03",
      "programmeStartsAtUtc": "2026-10-03T12:20:00Z",
      "eventStartsAtUtc": "2026-10-03T12:30:00Z",
      "scheduleTimeText": "2026-10-03 programme 22:20; event 22:30",
      "scheduleTimeZone": "Australia/Sydney",
      "sourceUrl": "https://www.stan.com.au/watch/sport"
    },
    {
      "sourceListingId": "stan-reviewed-20261001-009",
      "rawTitle": "Australian Schoolboys/U18s",
      "rawSport": "Rugby",
      "rawCompetition": "Australian Schoolboys/U18s",
      "rawParticipants": [],
      "channelBrand": "Stan Sport",
      "territory": "AU",
      "serviceId": "stan_sport",
      "accessType": "included",
      "liveOrReplay": "live",
      "timeConfidence": "exact",
      "localDate": "2026-10-04",
      "programmeStartsAtUtc": "2026-10-03T23:25:00Z",
      "eventStartsAtUtc": "2026-10-03T23:30:00Z",
      "scheduleTimeText": "2026-10-04 programme 10:25; event 10:30",
      "scheduleTimeZone": "Australia/Sydney",
      "sourceUrl": "https://www.stan.com.au/watch/sport"
    },
    {
      "sourceListingId": "stan-reviewed-20261001-010",
      "rawTitle": "WXV",
      "rawSport": "Rugby",
      "rawCompetition": "WXV",
      "rawParticipants": [],
      "channelBrand": "Stan Sport",
      "territory": "AU",
      "serviceId": "stan_sport",
      "accessType": "included",
      "liveOrReplay": "live",
      "timeConfidence": "exact",
      "localDate": "2026-10-04",
      "programmeStartsAtUtc": "2026-10-04T09:50:00Z",
      "eventStartsAtUtc": "2026-10-04T10:00:00Z",
      "scheduleTimeText": "2026-10-04 programme 20:50; event 21:00",
      "scheduleTimeZone": "Australia/Sydney",
      "sourceUrl": "https://www.stan.com.au/watch/sport"
    },
    {
      "sourceListingId": "stan-reviewed-20261001-011",
      "rawTitle": "Motocross Of Nations",
      "rawSport": "Motorsport",
      "rawCompetition": "Motocross Of Nations",
      "rawParticipants": [],
      "channelBrand": "Stan Sport",
      "territory": "AU",
      "serviceId": "stan_sport",
      "accessType": "included",
      "liveOrReplay": "live",
      "timeConfidence": "unknown",
      "localDate": "2026-10-04",
      "programmeStartsAtUtc": "2026-10-04T11:00:00Z",
      "eventStartsAtUtc": null,
      "scheduleTimeText": "2026-10-04 programme 22:00; event not separately listed",
      "scheduleTimeZone": "Australia/Sydney",
      "sourceUrl": "https://www.stan.com.au/watch/sport"
    }
  ]
}
