{
  "schemaVersion": "broadcaster-schedule-export.v1",
  "snapshotId": "stan-sport-au-2026-08-13T02-00Z",
  "sourceId": "stan_sport",
  "sourceMode": "reviewed_export",
  "territory": "AU",
  "sourceUrl": "https://www.stan.com.au/watch/sport",
  "observedAt": "2026-08-13T02:00:00Z",
  "reviewedAt": "2026-08-13T02:05:00Z",
  "reviewedBy": "nothingSport source review",
  "windowStart": "2026-08-13",
  "windowEnd": "2027-05-02",
  "checksum": "reviewed-stan-sport-2026-08-13-v1",
  "items": [
    {
      "sourceListingId": "uefa-super-cup-2026-08-13",
      "rawTitle": "UEFA Super Cup",
      "rawSport": "Football",
      "rawCompetition": "UEFA competitions",
      "rawParticipants": [],
      "channelBrand": "Stan Sport",
      "territory": "AU",
      "serviceId": "stan_sport",
      "accessType": "included",
      "liveOrReplay": "live",
      "timeConfidence": "exact",
      "localDate": "2026-08-13",
      "programmeStartsAtUtc": "2026-08-12T18:54:00Z",
      "eventStartsAtUtc": "2026-08-12T19:00:00Z",
      "scheduleTimeText": "Thu, 13 Aug 4:54am; kick off 5:00am",
      "scheduleTimeZone": "Australia/Sydney",
      "sourceUrl": "https://www.stan.com.au/watch/sport"
    },
    {
      "sourceListingId": "wta-1000-2026-08-13",
      "rawTitle": "WTA 1000",
      "rawSport": "Tennis",
      "rawCompetition": "WTA Tour",
      "rawParticipants": [],
      "channelBrand": "Stan Sport",
      "territory": "AU",
      "serviceId": "stan_sport",
      "accessType": "included",
      "liveOrReplay": "live",
      "timeConfidence": "date_only",
      "localDate": "2026-08-13",
      "programmeStartsAtUtc": "2026-08-12T23:00:00Z",
      "eventStartsAtUtc": "2026-08-12T23:00:00Z",
      "scheduleTimeText": "Thu, 13 Aug 9:00am",
      "scheduleTimeZone": "Australia/Sydney",
      "sourceUrl": "https://www.stan.com.au/watch/sport"
    },
    {
      "sourceListingId": "formula-e-2026-08-15",
      "rawTitle": "Formula E",
      "rawSport": "Motorsport",
      "rawCompetition": "Formula E",
      "rawParticipants": [],
      "channelBrand": "Stan Sport",
      "territory": "AU",
      "serviceId": "stan_sport",
      "accessType": "included",
      "liveOrReplay": "live",
      "timeConfidence": "exact",
      "localDate": "2026-08-15",
      "programmeStartsAtUtc": "2026-08-14T14:50:00Z",
      "eventStartsAtUtc": "2026-08-14T14:55:00Z",
      "scheduleTimeText": "Sat, 15 Aug 12:50am; starts 12:55am",
      "scheduleTimeZone": "Australia/Sydney",
      "sourceUrl": "https://www.stan.com.au/watch/sport"
    },
    {
      "sourceListingId": "fa-community-shield-2026-08-16",
      "rawTitle": "FA Community Shield",
      "rawSport": "Football",
      "rawCompetition": "FA Community Shield",
      "rawParticipants": [],
      "channelBrand": "Stan Sport",
      "territory": "AU",
      "serviceId": "stan_sport",
      "accessType": "included",
      "liveOrReplay": "live",
      "timeConfidence": "exact",
      "localDate": "2026-08-16",
      "programmeStartsAtUtc": "2026-08-16T13:45:00Z",
      "eventStartsAtUtc": "2026-08-16T14:00:00Z",
      "scheduleTimeText": "Sun, 16 Aug 11:45pm; kick off 12:00am",
      "scheduleTimeZone": "Australia/Sydney",
      "sourceUrl": "https://www.stan.com.au/watch/sport"
    },
    {
      "sourceListingId": "premier-league-2026-08-22",
      "rawTitle": "Premier League",
      "rawSport": "Football",
      "rawCompetition": "Premier League",
      "rawParticipants": [],
      "channelBrand": "Stan Sport",
      "territory": "AU",
      "serviceId": "stan_sport",
      "accessType": "included",
      "liveOrReplay": "live",
      "timeConfidence": "exact",
      "localDate": "2026-08-22",
      "programmeStartsAtUtc": "2026-08-21T18:00:00Z",
      "eventStartsAtUtc": "2026-08-21T19:00:00Z",
      "scheduleTimeText": "Sat, 22 Aug 4:00am; kick off 5:00am",
      "scheduleTimeZone": "Australia/Sydney",
      "sourceUrl": "https://www.stan.com.au/watch/sport"
    },
    {
      "sourceListingId": "premier-league-saturday-wrap-2026-08-23",
      "rawTitle": "PL Saturday Wrap",
      "rawSport": "Football",
      "rawCompetition": "Premier League",
      "rawParticipants": [],
      "channelBrand": "Stan Sport",
      "territory": "AU",
      "serviceId": "stan_sport",
      "accessType": "included",
      "liveOrReplay": "studio",
      "timeConfidence": "exact",
      "localDate": "2026-08-23",
      "programmeStartsAtUtc": "2026-08-22T22:00:00Z",
      "eventStartsAtUtc": null,
      "scheduleTimeText": "Sun, 23 Aug 8:00am",
      "scheduleTimeZone": "Australia/Sydney",
      "sourceUrl": "https://www.stan.com.au/watch/sport"
    }
  ]
}
